{"apps":[{"deployedVersion":null,"lestoDepRange":"^0.2.0","migrationVersions":null,"name":"snackday-web","wranglerConfig":"apps/web/wrangler.jsonc"}],"authorization":{"mergeReceipts":null,"reason":"NO_AUTHORIZATION_LEDGER"},"contracts":{"lesto":{"compatStatus":"consistent","deployJsonSchemaVersion":1,"npmSurfaceVersion":null,"packageCount":68,"remoteTruthRole":"non-authoritative","scaffoldDepRange":"^0.2.0","studioConsumerPinnedVersion":1},"studio":{"apiContractVersion":"1.0.0","dbSchemaVersion":71,"hashRole":"diagnostic","openapiSha256":"3fc48d942804421318fffc4359dd20b57b889e7899b34de3aa755b138c83b73b","wsEventSchemaSha256":"0dcc8327d41d384858d131656ef58b77cbe930723f5b5dce7b1777ae5915d8d7"},"templateContractVersion":null},"generatedAt":"2026-07-16T21:41:28Z","generator":{"tool":"@snackday/platform-manifest","version":"0.0.0"},"releases":{"lesto":{"channel":"npm","locallyVerified":false,"version":"0.2.0"},"reasonForNulls":"NO_TAGGED_RELEASE_EVER_CUT","remoteTruthRole":"non-authoritative","roof":null,"studio":null},"repos":[{"branch":"main","dirty":{"clean":true,"fileCount":0},"durable":true,"gateCommand":"bun run gate","gateEnforcedInCI":true,"head":"ecb0d42137d173ae65952d12cb66b39adc772de2","latestTag":"@lesto/sites@0.1.0","name":"lesto","operationalFactsRole":"non-authoritative","path":"/Users/ryan/crack","releasePipeline":"dispatch-only","remote":"git@github.com:lesto-run/lesto.git","tagsAuthoritative":false,"upstream":{"ahead":0,"behind":0,"configured":true}},{"branch":"main","dirty":{"clean":true,"fileCount":0},"durable":false,"gateCommand":"swift test && scripts/check-fixture-freshness.sh","gateEnforcedInCI":true,"head":"f1f3abbdede732dd647798fca8ddfd93ac098be3","latestTag":null,"name":"roof","operationalFactsRole":"non-authoritative","path":"/Users/ryan/src","releasePipeline":"tag-push","remote":"https://github.com/rdimascio/roof.git","tagsAuthoritative":false,"upstream":{"ahead":12,"behind":1,"configured":true}},{"branch":"main","dirty":{"clean":false,"fileCount":7},"durable":false,"gateCommand":"bun run gate","gateEnforcedInCI":false,"head":"54443aac30847ca0a02529de93823a54e48d713e","latestTag":null,"name":"snackday","operationalFactsRole":"non-authoritative","path":"/Users/ryan/snackday","releasePipeline":"none","remote":null,"tagsAuthoritative":false,"upstream":null},{"branch":"main","dirty":{"clean":false,"fileCount":9},"durable":false,"gateCommand":"bun run typecheck && bun run lint && bun run test && bun run test:e2e","gateEnforcedInCI":true,"head":"46f7f7d4f2cf798dab9e5262855118abf6ad50f8","latestTag":null,"name":"studio","operationalFactsRole":"non-authoritative","path":"/Users/ryan/every-io/studio","releasePipeline":"tag-push","remote":"https://github.com/rdimascio/studio.git","tagsAuthoritative":false,"upstream":{"ahead":1,"behind":0,"configured":true}}],"rollback":[{"component":"lesto","everExercised":true,"evidenceRole":"non-authoritative","mechanism":"pointer-flip","scripted":true},{"component":"roof","everExercised":false,"evidenceRole":"non-authoritative","mechanism":"appcast-repoint-unscripted","scripted":false},{"component":"snackday","everExercised":false,"evidenceRole":"non-authoritative","mechanism":"unknown","scripted":false},{"component":"studio","everExercised":false,"evidenceRole":"non-authoritative","mechanism":"undocumented-manual","scripted":false}],"schema":"platform-manifest/v0","signed":false,"unknowns":[{"field":"/apps/0/deployedVersion","reason":"DEPLOYED_VERSION_NOT_LOCALLY_VERIFIED"},{"field":"/apps/0/migrationVersions","reason":"MIGRATION_VERSIONS_NOT_EXTRACTED"},{"field":"/authorization/mergeReceipts","reason":"NO_AUTHORIZATION_LEDGER"},{"field":"/contracts/lesto/npmSurfaceVersion","reason":"REMOTE_TRUTH_UNVERIFIED"},{"field":"/contracts/templateContractVersion","reason":"NO_TEMPLATE_CONTRACT"},{"field":"/releases/roof","reason":"NO_TAGGED_RELEASE_EVER_CUT"},{"field":"/releases/studio","reason":"NO_TAGGED_RELEASE_EVER_CUT"},{"field":"/repos/1/latestTag","reason":"NO_LOCAL_TAG"},{"field":"/repos/2/latestTag","reason":"NO_LOCAL_TAG"},{"field":"/repos/2/remote","reason":"NO_REMOTE"},{"field":"/repos/2/upstream","reason":"NO_UPSTREAM"},{"field":"/repos/3/latestTag","reason":"NO_LOCAL_TAG"}]}